{
  "audited_at": "2026-09-13T16:58:09Z",
  "checks_passed": [
    {
      "rule_id": "ACC-001",
      "summary": "No answer-time retrieval crawler (OAI-SearchBot, PerplexityBot, Claude-SearchBot, Googlebot, Bingbot) is shut out by the * group in robots.txt"
    },
    {
      "rule_id": "ACC-002",
      "summary": "robots.txt answered HTTP 200, which lets compliant crawlers proceed"
    },
    {
      "rule_id": "ACC-004",
      "summary": "No primary page template carries nosnippet or max-snippet:0 (9 primary 2xx pages examined)"
    },
    {
      "rule_id": "ACC-005",
      "summary": "Distinct pages do not declare the home page as canonical (0 of 11 non-root pages with a canonical do)"
    },
    {
      "rule_id": "ACC-008",
      "summary": "No answer-time retrieval crawler is excluded by name in robots.txt"
    },
    {
      "rule_id": "ACC-009",
      "summary": "Every assessable sitemap declared in robots.txt returned a readable sitemap (1 file)"
    },
    {
      "rule_id": "ARR-001",
      "summary": "Median server response time (time to first byte minus connection setup) is 1 ms across 12 pages, within web.dev's 1,800 ms poor boundary"
    },
    {
      "rule_id": "IDM-001",
      "summary": "The home page's JSON-LD states an organization identity"
    },
    {
      "rule_id": "IDM-003",
      "summary": "Every JSON-LD block parsed on 8 pages carrying JSON-LD"
    },
    {
      "rule_id": "PRO-003",
      "summary": "Identity links (sameAs) are declared in the markup, so none is recommended; whether their values identify anything is checked by IDM-002"
    },
    {
      "rule_id": "RND-001",
      "summary": "No template depends on JavaScript for its text: 0 of 12 rendered pages compared are JavaScript-dependent, below the template threshold"
    }
  ],
  "findings": [
    {
      "category": "discoverability",
      "confidence": "high",
      "evidence": "7 of 7 sampled 2xx product pages carry noindex or none in their robots meta tag or X-Robots-Tag header (100%). A page excluded from the index cannot be retrieved into an answer.",
      "evidence_refs": [
        {
          "layer": "first_party",
          "method": "render",
          "observation": "robots directives in effect: noindex",
          "retrieved_at": "2026-09-13T16:58:11Z",
          "url": "http://127.0.0.1:58409/products/trail-tee"
        },
        {
          "layer": "first_party",
          "method": "render",
          "observation": "robots directives in effect: noindex",
          "retrieved_at": "2026-09-13T16:58:11Z",
          "url": "http://127.0.0.1:58409/products/summit-cap"
        },
        {
          "layer": "first_party",
          "method": "render",
          "observation": "robots directives in effect: noindex",
          "retrieved_at": "2026-09-13T16:58:11Z",
          "url": "http://127.0.0.1:58409/products/delta-socks"
        },
        {
          "layer": "first_party",
          "method": "render",
          "observation": "robots directives in effect: noindex",
          "retrieved_at": "2026-09-13T16:58:11Z",
          "url": "http://127.0.0.1:58409/products/meadow-scarf"
        },
        {
          "layer": "first_party",
          "method": "render",
          "observation": "robots directives in effect: noindex",
          "retrieved_at": "2026-09-13T16:58:11Z",
          "url": "http://127.0.0.1:58409/products/ridge-gloves"
        },
        {
          "layer": "first_party",
          "method": "render",
          "observation": "robots directives in effect: noindex",
          "retrieved_at": "2026-09-13T16:58:11Z",
          "url": "http://127.0.0.1:58409/products/canyon-jacket"
        },
        {
          "layer": "first_party",
          "method": "render",
          "observation": "robots directives in effect: noindex",
          "retrieved_at": "2026-09-13T16:58:11Z",
          "url": "http://127.0.0.1:58409/products/harbor-hoodie"
        }
      ],
      "exceptions_checked": [
        "editorial noindex on single pages: at least 2 pages and 50% of the type required",
        "syndicated copies pointing elsewhere by canonical: excluded"
      ],
      "false_positive_controls_applied": [
        "2xx pages only",
        "exact token match after lower-casing",
        "X-Robots-Tag scopes other than the retrieval crawlers ignored",
        "pages declaring another URL as canonical excluded",
        "category, contact, policy and other pages never counted"
      ],
      "id": "F-001",
      "impact": {
        "blocking": true,
        "breadth": "section",
        "content_importance": "primary"
      },
      "rule_id": "ACC-003",
      "scope": {
        "page_types": [
          "product"
        ],
        "pages_affected": 7,
        "pages_examined": 7
      },
      "severity": "high",
      "skill": "access-and-indexability",
      "status": "found",
      "suggested_action": {
        "effort": "low",
        "how": "Find the template or SEO-plugin setting that applies the directive to the whole type, often a 'discourage indexing' toggle left on from staging, and scope it to the pages actually meant to be excluded.",
        "mechanism": "Index admission for the affected template.",
        "priority": "P1",
        "success_criteria": "A plain fetch of every cited URL returns no noindex or none in either the robots meta tag or X-Robots-Tag.",
        "summary": "Remove noindex from the product template or the header rule that emits it.",
        "what": "Remove noindex (or none) from the product page template, or from the header rule adding it.",
        "where": "The robots meta tag in the product template or the server/CDN rule setting X-Robots-Tag, on the URLs cited.",
        "why": "The directive is applied after fetching, so no amount of crawl access recovers the page."
      },
      "symptom": [
        "invisible"
      ],
      "title": "Pages of type product refuse indexing"
    },
    {
      "category": "discoverability",
      "confidence": "medium",
      "evidence": "Rendered 7 eligible product pages; a price appears in the rendered text of 5 and in neither the server text nor server JSON-LD of those 5. Examples: http://127.0.0.1:58409/products/trail-tee (rendered shows ₹999.00); http://127.0.0.1:58409/products/summit-cap (rendered shows ₹999.00); http://127.0.0.1:58409/products/delta-socks (rendered shows ₹999.00); http://127.0.0.1:58409/products/canyon-jacket (rendered shows ₹999.00); http://127.0.0.1:58409/products/harbor-hoodie (rendered shows ₹999.00).",
      "evidence_refs": [
        {
          "layer": "first_party",
          "method": "render",
          "observation": "no price token in server text or JSON-LD; rendered text contains ₹999.00",
          "retrieved_at": "2026-09-13T16:58:11Z",
          "url": "http://127.0.0.1:58409/products/trail-tee"
        },
        {
          "layer": "first_party",
          "method": "render",
          "observation": "no price token in server text or JSON-LD; rendered text contains ₹999.00",
          "retrieved_at": "2026-09-13T16:58:11Z",
          "url": "http://127.0.0.1:58409/products/summit-cap"
        },
        {
          "layer": "first_party",
          "method": "render",
          "observation": "no price token in server text or JSON-LD; rendered text contains ₹999.00",
          "retrieved_at": "2026-09-13T16:58:11Z",
          "url": "http://127.0.0.1:58409/products/delta-socks"
        },
        {
          "layer": "first_party",
          "method": "render",
          "observation": "no price token in server text or JSON-LD; rendered text contains ₹999.00",
          "retrieved_at": "2026-09-13T16:58:11Z",
          "url": "http://127.0.0.1:58409/products/canyon-jacket"
        },
        {
          "layer": "first_party",
          "method": "render",
          "observation": "no price token in server text or JSON-LD; rendered text contains ₹999.00",
          "retrieved_at": "2026-09-13T16:58:11Z",
          "url": "http://127.0.0.1:58409/products/harbor-hoodie"
        }
      ],
      "exceptions_checked": [
        "quote-on-request pricing: no price in rendered text either, so never matches",
        "region-selected pricing: undetectable, confidence below high under 8 pages"
      ],
      "false_positive_controls_applied": [
        "same currency-token pattern applied to both texts",
        "pages with any price in the server text excluded",
        "pages exposing offers.price or offers.lowPrice in server JSON-LD excluded",
        "JavaScript-dependent pages left to RND-001",
        "page_type_confidence >= 0.6"
      ],
      "id": "F-002",
      "impact": {
        "blocking": true,
        "breadth": "section",
        "content_importance": "primary"
      },
      "rule_id": "RND-003",
      "scope": {
        "page_types": [
          "product"
        ],
        "pages_affected": 5,
        "pages_examined": 7
      },
      "severity": "high",
      "skill": "render-and-extraction",
      "status": "found",
      "suggested_action": {
        "effort": "medium",
        "how": "Render the price component on the server, or emit Product with offers.price and offers.priceCurrency in JSON-LD generated server-side.",
        "mechanism": "The price becomes extractable and quotable.",
        "priority": "P1",
        "success_criteria": "The price appears in the server response, as text or as offers.price JSON-LD, on every cited product URL, verifiable with a plain fetch and no JavaScript.",
        "summary": "Server-render the product price, or emit Offer JSON-LD with offers.price in the server response.",
        "what": "Include the price in the server response of the product template, as visible text or Offer JSON-LD.",
        "where": "The product page template and its price component, on the URLs cited.",
        "why": "The server response is what a fetcher extracts, and it holds a product without a price."
      },
      "symptom": [